{
  "name": "Fertility Tracker API",
  "description": "Fertility, births, deaths, net migration, migrant stocks, UN projections to 2100 and a population-decline risk score for every country. Static files, no key, CORS open, refreshed weekly.",
  "apiVersion": "v1",
  "schemaVersion": "1.0.0",
  "generatedAt": "2026-10-27T00:35:59Z",
  "contentHash": "74dd7f4825f4bff6d395b770ba46f626c86c5fd662d53237887bf9754704b571",
  "baseUrl": "https://rostyslavdzhohola.github.io/fertility-tracker/api/v1/",
  "latestEstimateYear": 2023,
  "replacementTfr": 2.1,
  "counts": {
    "records": 238,
    "ranked": 200,
    "unranked": 38
  },
  "sources": [
    {
      "id": "UN-WPP",
      "name": "World Population Prospects 2024",
      "publisher": "United Nations, Department of Economic and Social Affairs, Population Division",
      "via": "Our World in Data (grapher and explorer CSV downloads)",
      "homepage": "https://population.un.org/wpp/",
      "license": "CC BY 3.0 IGO (UN); OWID processing CC BY 4.0",
      "citation": "UN, World Population Prospects (2024) – processed by Our World in Data",
      "vintage": "2024-07-12",
      "nextUpdate": "2027-07-12",
      "coverage": "Estimates 1950 to the latest estimate year; medium-variant projections to 2100",
      "datasets": [
        {
          "id": "fertility",
          "title": "Fertility rate (births per woman)",
          "url": "https://ourworldindata.org/grapher/fertility-rate-with-projections.csv?v=1&csvType=full&useColumnShortNames=true",
          "metadataUrl": "https://ourworldindata.org/grapher/fertility-rate-with-projections.metadata.json?v=1&csvType=full&useColumnShortNames=true",
          "status": "ok",
          "columns": [
            "fertility_rate__sex_all__age_all__variant_estimates",
            "fertility_rate__sex_all__age_all__variant_medium__projected"
          ],
          "lastUpdated": "2024-07-12",
          "timespan": "1950-2023, 2024-2100"
        },
        {
          "id": "population",
          "title": "Population (1 July)",
          "url": "https://ourworldindata.org/grapher/population-with-un-projections.csv?v=1&csvType=full&useColumnShortNames=true",
          "metadataUrl": "https://ourworldindata.org/grapher/population-with-un-projections.metadata.json?v=1&csvType=full&useColumnShortNames=true",
          "status": "ok",
          "columns": [
            "population__sex_all__age_all__variant_estimates",
            "population__sex_all__age_all__variant_medium__projected"
          ],
          "lastUpdated": "2024-07-12",
          "timespan": "1950-2023, 2024-2100"
        },
        {
          "id": "birthsDeaths",
          "title": "Births and deaths per year",
          "url": "https://ourworldindata.org/grapher/births-and-deaths-projected-to-2100.csv?v=1&csvType=full&useColumnShortNames=true",
          "metadataUrl": "https://ourworldindata.org/grapher/births-and-deaths-projected-to-2100.metadata.json?v=1&csvType=full&useColumnShortNames=true",
          "status": "ok",
          "columns": [
            "births__sex_all__age_all__variant_estimates",
            "births__sex_all__age_all__variant_medium__projected",
            "deaths__sex_all__age_all__variant_estimates",
            "deaths__sex_all__age_all__variant_medium__projected"
          ],
          "lastUpdated": "2024-07-12",
          "timespan": "1950-2023, 2024-2100"
        },
        {
          "id": "netMigration",
          "title": "Net migration (immigrants minus emigrants per year)",
          "url": "https://ourworldindata.org/explorers/population-and-demography.csv?v=1&csvType=full&useColumnShortNames=true&indicator=Net+migration&Sex=Both+sexes&Age=Total&Projection+scenario=Medium",
          "metadataUrl": "https://ourworldindata.org/explorers/population-and-demography.metadata.json?v=1&csvType=full&useColumnShortNames=true&indicator=Net+migration&Sex=Both+sexes&Age=Total&Projection+scenario=Medium",
          "status": "ok",
          "columns": [
            "net_migration__sex_all__age_all__variant_estimates",
            "net_migration__sex_all__age_all__variant_medium__projected"
          ],
          "lastUpdated": "2024-07-12",
          "timespan": "1950-2023, 2024-2100"
        },
        {
          "id": "medianAge",
          "title": "Median age",
          "url": "https://ourworldindata.org/grapher/median-age.csv?v=1&csvType=full&useColumnShortNames=true",
          "metadataUrl": "https://ourworldindata.org/grapher/median-age.metadata.json?v=1&csvType=full&useColumnShortNames=true",
          "status": "ok",
          "columns": [
            "median_age__sex_all__age_all__variant_estimates",
            "median_age__sex_all__age_all__variant_medium__projected"
          ],
          "lastUpdated": "2024-07-12",
          "timespan": "1950-2023, 2024-2100"
        },
        {
          "id": "ageStructure",
          "title": "Population aged 65+ (for share65)",
          "url": "https://ourworldindata.org/grapher/population-by-age-group-with-projections.csv?v=1&csvType=full&useColumnShortNames=true",
          "metadataUrl": "https://ourworldindata.org/grapher/population-by-age-group-with-projections.metadata.json?v=1&csvType=full&useColumnShortNames=true",
          "status": "ok",
          "columns": [
            "population__sex_all__age_65plus__variant_estimates",
            "population__sex_all__age_65plus__variant_medium__projected",
            "population__sex_all__age_all__variant_estimates",
            "population__sex_all__age_all__variant_medium__projected"
          ],
          "lastUpdated": "2024-07-12",
          "timespan": "1950-2023, 2024-2100"
        }
      ]
    },
    {
      "id": "UN-DESA",
      "name": "International Migrant Stock 2024",
      "publisher": "United Nations, Department of Economic and Social Affairs, Population Division",
      "via": "Our World in Data (grapher CSV downloads)",
      "homepage": "https://www.un.org/development/desa/pd/content/international-migrant-stock",
      "license": "CC BY 3.0 IGO (UN); OWID processing CC BY 4.0",
      "citation": "United Nations Department of Economic and Social Affairs (2024) – with minor processing by Our World in Data",
      "vintage": "2025-03-12",
      "nextUpdate": "2027-03-12",
      "coverage": "Migrant stocks by country of residence and of birth, 1990-2020 every 5 years plus 2024",
      "datasets": [
        {
          "id": "immigrants",
          "title": "Immigrant stock: people living here who were born abroad",
          "url": "https://ourworldindata.org/grapher/migrant-populations.csv?v=1&csvType=full&useColumnShortNames=true&metric=immigrants&unit=number",
          "metadataUrl": "https://ourworldindata.org/grapher/migrant-populations.metadata.json?v=1&csvType=full&useColumnShortNames=true&metric=immigrants&unit=number",
          "status": "ok",
          "columns": [
            "immigrants_all"
          ],
          "lastUpdated": "2025-03-12",
          "timespan": "1990-2024"
        },
        {
          "id": "immigrantsShare",
          "title": "Immigrant stock, % of population",
          "url": "https://ourworldindata.org/grapher/migrant-populations.csv?v=1&csvType=full&useColumnShortNames=true&metric=immigrants&unit=share",
          "metadataUrl": "https://ourworldindata.org/grapher/migrant-populations.metadata.json?v=1&csvType=full&useColumnShortNames=true&metric=immigrants&unit=share",
          "status": "ok",
          "columns": [
            "immigrant_share_of_dest_population_all"
          ],
          "lastUpdated": "2025-03-12",
          "timespan": "1990-2024"
        },
        {
          "id": "emigrants",
          "title": "Emigrant stock: people born here living abroad",
          "url": "https://ourworldindata.org/grapher/migrant-populations.csv?v=1&csvType=full&useColumnShortNames=true&metric=emigrants&unit=number",
          "metadataUrl": "https://ourworldindata.org/grapher/migrant-populations.metadata.json?v=1&csvType=full&useColumnShortNames=true&metric=emigrants&unit=number",
          "status": "ok",
          "columns": [
            "emigrants_all"
          ],
          "lastUpdated": "2025-03-12",
          "timespan": "1990-2024"
        },
        {
          "id": "emigrantsShare",
          "title": "Emigrant stock, % of population of origin",
          "url": "https://ourworldindata.org/grapher/migrant-populations.csv?v=1&csvType=full&useColumnShortNames=true&metric=emigrants&unit=share",
          "metadataUrl": "https://ourworldindata.org/grapher/migrant-populations.metadata.json?v=1&csvType=full&useColumnShortNames=true&metric=emigrants&unit=share",
          "status": "ok",
          "columns": [
            "emigrants_share_of_total_population"
          ],
          "lastUpdated": "2025-03-12",
          "timespan": "1990-2024"
        },
        {
          "id": "migrationCorridors",
          "title": "Migrant stock by country of origin and destination (top partners)",
          "url": "https://ourworldindata.org/grapher/migration-origin-destination.csv?v=1&csvType=full&useColumnShortNames=true&country_select={country_slug}&metric={immigrants|emigrants}&gender=all",
          "metadataUrl": "https://ourworldindata.org/grapher/migration-origin-destination.metadata.json?v=1&csvType=full&useColumnShortNames=true",
          "status": "ok",
          "columns": [
            "migrants__country_select_{country}__metric_{immigrants|emigrants}__gender_all"
          ],
          "lastUpdated": "2025-03-18",
          "timespan": "1990-2024"
        }
      ]
    },
    {
      "id": "WB",
      "name": "World Development Indicators",
      "publisher": "World Bank",
      "via": "World Bank Indicators API v2 (latest non-empty value per country, mrnev=1)",
      "homepage": "https://data.worldbank.org/",
      "license": "CC BY 4.0",
      "citation": "World Bank, World Development Indicators",
      "vintage": "2026-10-08",